{
  "schema_version": "v1",
  "project": "u-boot",
  "cve": "CVE-2018-3968",
  "categories": {
    "call_graph": [
      {"caller": "do_bootm",          "callee": "do_bootm_states",   "file": "common/cmd_bootm.c", "line": 825,  "kind": "direct"},
      {"caller": "do_bootm_states",   "callee": "bootm_find_os",     "file": "common/cmd_bootm.c", "line": 646,  "kind": "direct"},
      {"caller": "bootm_find_os",     "callee": "boot_get_kernel",   "file": "common/cmd_bootm.c", "line": 224,  "kind": "direct"},
      {"caller": "bootm_find_os",     "callee": "genimg_get_format", "file": "common/cmd_bootm.c", "line": 232,  "kind": "direct"},
      {"caller": "boot_get_kernel",   "callee": "genimg_get_format", "file": "common/cmd_bootm.c", "line": 954,  "kind": "direct"},
      {"caller": "boot_get_kernel",   "callee": "image_get_kernel",  "file": "common/cmd_bootm.c", "line": 958,  "kind": "direct"},
      {"caller": "image_get_kernel",  "callee": "image_check_magic", "file": "common/cmd_bootm.c", "line": 866,  "kind": "direct"},
      {"caller": "image_get_kernel",  "callee": "image_check_hcrc",  "file": "common/cmd_bootm.c", "line": 873,  "kind": "direct"},
      {"caller": "image_get_kernel",  "callee": "image_check_dcrc",  "file": "common/cmd_bootm.c", "line": 884,  "kind": "direct"},
      {"caller": "genimg_get_format", "callee": "image_check_magic", "file": "common/image.c",     "line": 661,  "kind": "direct"}
    ],
    "data_control_flow": [
      {"function": "genimg_get_format", "file": "common/image.c",     "kind": "branch",  "summary": "Format selection: image_check_magic(hdr) at line 661 chooses IMAGE_FORMAT_LEGACY (line 662). The legacy branch is checked FIRST and unconditionally — the function returns the LEGACY format for any image whose first 4 bytes equal IH_MAGIC=0x27051956, regardless of CONFIG_FIT_SIGNATURE. There is no #if CONFIG_FIT_SIGNATURE guard around the legacy branch in the vulnerable code.", "line_start": 660, "line_end": 672},
      {"function": "boot_get_kernel",  "file": "common/cmd_bootm.c", "kind": "branch",  "summary": "switch (genimg_get_format(buf)) at line 954 dispatches to one of: IMAGE_FORMAT_LEGACY (line 955), IMAGE_FORMAT_FIT (under #if CONFIG_FIT, after legacy), IMAGE_FORMAT_ANDROID (under #ifdef CONFIG_ANDROID_BOOT_IMAGE). The LEGACY case at lines 955-996 calls image_get_kernel() and commits os_data/os_len without invoking any signature primitive (fit_image_verify, rsa_verify).", "line_start": 954, "line_end": 996},
      {"function": "image_get_kernel", "file": "common/cmd_bootm.c", "kind": "def_use", "summary": "Verifies legacy uImage by image_check_magic (line 866), image_check_hcrc (line 873) and, when verify=1, image_check_dcrc (line 884). All three are CRC integrity checks; none is a cryptographic signature. Returns hdr (line 898) on success — the caller boot_get_kernel then commits the legacy image as the kernel source.", "line_start": 862, "line_end": 898}
    ],
    "guards": [
      {"function": "genimg_get_format", "file": "common/image.c", "guard_call": "image_check_magic(hdr)", "guard_line": 661, "result_used": true, "enforcement_line": 662, "note": "Magic-number check that selects the LEGACY format. This is an INTEGRITY guard (matches IH_MAGIC), not an AUTHENTICITY guard. It accepts any attacker-supplied image whose first 4 bytes happen to be 0x27051956. There is no signature-required guard upstream: vulnerable code lacks an early `#if defined(CONFIG_FIT_SIGNATURE) && !defined(CONFIG_IMAGE_FORMAT_LEGACY)` rejection."},
      {"function": "image_get_kernel", "file": "common/cmd_bootm.c", "guard_call": "image_check_magic(hdr)", "guard_line": 866, "result_used": true, "enforcement_line": 869, "note": "Re-check of the magic number inside image_get_kernel. Same integrity-only semantics as above."},
      {"function": "image_get_kernel", "file": "common/cmd_bootm.c", "guard_call": "image_check_hcrc(hdr)", "guard_line": 873, "result_used": true, "enforcement_line": 876, "note": "Header CRC32 check. Integrity (detects accidental corruption); not authenticity (attacker can compute matching CRC32 trivially)."},
      {"function": "image_get_kernel", "file": "common/cmd_bootm.c", "guard_call": "image_check_dcrc(hdr)", "guard_line": 884, "result_used": true, "enforcement_line": 887, "note": "Data CRC32 check. Same integrity-only semantics. After this guard image_get_kernel returns success and the caller proceeds to load the kernel — at no point is rsa_verify or any signature primitive invoked on this branch."}
    ],
    "trust_boundaries": [
      {"kind": "external_io", "function": "do_bootm", "file": "common/cmd_bootm.c", "line": 786, "direction": "untrusted_to_trusted", "note": "U-Boot bootm command entrypoint. The image is read from RAM at load_addr (default) or from a memory-mapped region whose origin is attacker-controllable: NAND/SPI/eMMC writes, network-loaded buffers (tftpboot, dhcp), removable media (USB, SD), or the boot script itself. Any path that lands attacker bytes at the bootm load address crosses this boundary."}
    ],
    "config_mode_command_triggers": [
      {"kind": "ifdef", "name": "CONFIG_FIT",                "file": "common/cmd_bootm.c", "line": 920, "note": "#if defined(CONFIG_FIT) directive in boot_get_kernel — gates the FIT format branch in the format dispatch. CONFIG_FIT must be set for any signed-FIT support to exist; the vulnerability assumes CONFIG_FIT and CONFIG_FIT_SIGNATURE are both set (the operator wants to enforce signed boot)."},
      {"kind": "ifdef", "name": "CONFIG_FIT_SIGNATURE",      "file": "include/image.h",   "line": 835, "note": "#if defined(CONFIG_FIT_SIGNATURE) directive in include/image.h — turns on RSA signature verification primitives in the FIT-image path. The vulnerability is precisely that this flag does NOT disable the legacy format path: legacy uImages remain accepted on signature-enforcing builds. The fix introduces CONFIG_IMAGE_FORMAT_LEGACY (default OFF when CONFIG_FIT_SIGNATURE is set, see include/config_fallbacks.h:86-88 in the fix commit) to close this gap."},
      {"kind": "ifdef", "name": "CONFIG_ANDROID_BOOT_IMAGE", "file": "common/image.c",    "line": 667, "note": "#ifdef CONFIG_ANDROID_BOOT_IMAGE directive — optional alternate boot-image format. Not part of the vulnerability surface but recorded because genimg_get_format also dispatches to it after the legacy and FIT branches."}
    ],
    "callback_registrations": [
      {"registration_site": "U_BOOT_CMD(bootm, ...)", "callback_function": "do_bootm", "file": "common/cmd_bootm.c", "line": 1071, "kind": "struct_initializer", "note": "U_BOOT_CMD macro emits a struct cmd_tbl into the .u_boot_cmd linker section that registers do_bootm as the handler for the 'bootm' shell command. This is the install site that connects U-Boot's command parser to do_bootm — every shell-issued or boot-script-issued bootm reaches do_bootm via this registration."}
    ],
    "evidence_anchors": [
      {"file": "include/image.h",   "line": 239, "kind": "magic_value",        "note": "#define IH_MAGIC 0x27051956 — the legacy uImage magic. An attacker only needs to place these 4 bytes at offset 0 of a crafted blob for image_check_magic to succeed and the legacy code path to take over."},
      {"file": "include/image.h",   "line": 249, "kind": "structural_artifact", "note": "typedef struct image_header — the legacy uImage header struct. Layout (magic, hcrc, time, size, load, ep, dcrc, os, arch, type, comp, name) is what image_get_kernel walks; none of its fields carry a cryptographic signature."},
      {"file": "include/image.h",   "line": 415, "kind": "structural_artifact", "note": "#define IMAGE_FORMAT_LEGACY 0x01 — the format-tag constant returned by genimg_get_format and switched on by boot_get_kernel."},
      {"file": "include/image.h",   "line": 416, "kind": "structural_artifact", "note": "#define IMAGE_FORMAT_FIT 0x02 — the format-tag constant for FIT (signature-aware) images."}
    ]
  }
}
