{
  "schema_version": "v1",
  "project": "dnsmasq",
  "cve": "CVE-2017-14491",
  "categories": {
    "call_graph": [
      {
        "caller": "receive_query",
        "callee": "answer_request",
        "file": "src/forward.c",
        "line": 1439,
        "kind": "direct",
        "note": "UDP DNS path. receive_query reads a query packet from the listener socket, parses it, then calls answer_request to build a local-zone response into the same daemon->packet buffer. The 'limit' argument passed is ((char*)header) + udp_size — the end of the negotiated UDP buffer."
      },
      {
        "caller": "tcp_request",
        "callee": "answer_request",
        "file": "src/forward.c",
        "line": 1774,
        "kind": "direct",
        "note": "TCP DNS path. tcp_request handles each TCP-connected DNS client and calls answer_request to build local-zone responses. limit is set to header + 65536 (TCP DNS allows larger messages)."
      },
      {
        "caller": "answer_request",
        "callee": "add_resource_record",
        "file": "src/rfc1035.c",
        "line": 1289,
        "kind": "direct",
        "note": "answer_request iterates per-name and per-record-type and calls add_resource_record for each answer it wants to add. Many such call sites exist in the same function (rfc1035.c lines 1289, 1311, 1369, 1384, 1428, 1445, 1538, 1596, 1650, 1691, 1705, 1724, 1743, 1760, 1781, 1828, 1878). The 'limit' argument is forwarded from answer_request's own limit parameter."
      },
      {
        "caller": "add_resource_record",
        "callee": "do_rfc1035_name",
        "file": "src/rfc1035.c",
        "line": 1088,
        "kind": "direct",
        "note": "Writes the RR's name into the response buffer. In the vulnerable code do_rfc1035_name takes only (p, name) — the limit is NOT threaded through, which is part of the structural gap."
      },
      {
        "caller": "add_resource_record",
        "callee": "do_rfc1035_name",
        "file": "src/rfc1035.c",
        "line": 1140,
        "kind": "direct",
        "note": "Second call site inside add_resource_record's format-string loop (case 'd' / case 'p' name-bearing types)."
      }
    ],
    "data_control_flow": [
      {
        "function": "receive_query",
        "file": "src/forward.c",
        "kind": "def_use",
        "summary": "recvmsg fills daemon->packet with attacker-supplied DNS query bytes (recvmsg call inside this function). header := (struct dns_header *)daemon->packet at line 1119. The same buffer is reused as the response buffer for answer_request at line 1439 — meaning the attacker's input and the response cursor share storage, but the 'limit' passed to answer_request marks the end of the negotiated UDP size.",
        "line_start": 1117,
        "line_end": 1446
      },
      {
        "function": "answer_request",
        "file": "src/rfc1035.c",
        "kind": "def_use",
        "summary": "Maintains a moving cursor 'ansp' into the response buffer and threads the buffer 'limit' to add_resource_record. ansp is updated in-place by add_resource_record on each successful write, but the function itself does not validate limit vs. final cursor against attacker-influenced name lengths.",
        "line_start": 1209,
        "line_end": 1209
      },
      {
        "function": "add_resource_record",
        "file": "src/rfc1035.c",
        "kind": "def_use",
        "summary": "Local cursor 'p' starts at *pp and advances through PUTSHORT (line 1082, 1091, 1097, 1098, 1102), do_rfc1035_name (line 1088, 1140), *p++ writes (line 1094 and inside the format loop). None of these are gated on (p + size <= limit) in the vulnerable build.",
        "line_start": 1065,
        "line_end": 1170
      },
      {
        "function": "do_rfc1035_name",
        "file": "src/util.c",
        "kind": "def_use",
        "summary": "Takes (p, sval) with no limit. Inner loop at lines 250-258 writes one byte per character of each label segment via *p++ = *sval. For an attacker-influenced long name this walks past the response buffer end.",
        "line_start": 247,
        "line_end": 263
      }
    ],
    "guards": [
      {
        "function": "add_resource_record",
        "file": "src/rfc1035.c",
        "guard_call": "truncp && *truncp",
        "guard_line": 1075,
        "result_used": true,
        "enforcement_line": 1076,
        "note": "Early-out for when the caller has already marked the response truncated. Does NOT validate the cursor against the buffer limit. This is the only guard the vulnerable function actually performs before the unchecked write sequence."
      }
    ],
    "trust_boundaries": [
      {
        "kind": "network_socket",
        "function": "receive_query",
        "file": "src/forward.c",
        "line": 1117,
        "direction": "untrusted_to_trusted",
        "note": "UDP DNS receive path. Called from the main event loop in src/dnsmasq.c when the UDP listener fd is ready; reads an attacker-supplied DNS query into daemon->packet."
      },
      {
        "kind": "network_socket",
        "function": "tcp_request",
        "file": "src/forward.c",
        "line": 1604,
        "direction": "untrusted_to_trusted",
        "note": "TCP DNS receive path. Called per-connection from the main loop in dnsmasq.c at line 1709; reads framed DNS messages from the TCP socket, then calls answer_request the same way receive_query does."
      }
    ],
    "config_mode_command_triggers": [
      {
        "kind": "unknown",
        "name": "--auth-zone / --local-zone",
        "file": "src/forward.c",
        "line": 1439,
        "note": "kind=unknown: this row records a deployment-config dependency, not a substrate fact about the cited line. Line 1439 is the answer_request call site (a regular C statement), NOT the directive / parser site for the --auth-zone or --local-zone CLI options (those live in src/option.c). The fact being communicated is 'reaching answer_request requires the daemon to be configured with auth/local zones'. Per PLAN §4.6 #8, 'unknown' with this note is more honest than the cli_argument enum, which conventionally points at the parsing site. CVE is reachable on hosts that enable auth/local zones — including default OpenWrt and many embedded configurations."
      },
      {
        "kind": "ifdef",
        "name": "HAVE_IPV6",
        "file": "src/rfc1035.c",
        "line": 1107,
        "note": "case '6' in add_resource_record's format loop is gated by HAVE_IPV6. The other unbounded writes (PUTSHORT, PUTLONG, do_rfc1035_name, *p++) are unconditional — the vulnerable arithmetic is not behind any feature flag."
      }
    ],
    "callback_registrations": [
      {
        "registration_site": "main loop in src/dnsmasq.c — per-listener poll_check + direct call",
        "callback_function": "receive_query",
        "file": "src/dnsmasq.c",
        "line": 1565,
        "kind": "unknown",
        "note": "kind=unknown: receive_query is called directly from the dnsmasq main event loop (src/dnsmasq.c:1565) after poll_check() reports readiness on the UDP listener fd. There is no function-pointer table, signal handler, function-pointer assignment, or constructor attribute — it is a direct call from the main loop. Per PLAN §4.6 #8, recording 'unknown' rather than force-fitting an enum value. The TCP counterpart, tcp_request, is called from the same main loop at src/dnsmasq.c:1709 (next entry)."
      },
      {
        "registration_site": "main loop in src/dnsmasq.c — TCP accept + direct call",
        "callback_function": "tcp_request",
        "file": "src/dnsmasq.c",
        "line": 1709,
        "kind": "unknown",
        "note": "kind=unknown: per-connection TCP DNS dispatch from the dnsmasq main event loop after accept(). Same dispatch character as the receive_query entry above — direct call, no callback registration mechanism. Per PLAN §4.6 #8."
      }
    ],
    "evidence_anchors": []
  }
}
