{
  "schema_version": "v1",
  "project": "contiki-ng",
  "cve": "CVE-2021-21281",
  "categories": {
    "call_graph": [
      {
        "caller": "input_callback",
        "callee": "tcpip_input",
        "file": "os/net/ipv6/sicslowpan.c",
        "line": 2056,
        "kind": "direct"
      },
      {
        "caller": "tcpip_input",
        "callee": "process_post_synch",
        "file": "os/net/ipv6/tcpip.c",
        "line": 449,
        "kind": "direct"
      },
      {
        "caller": "tcpip_process",
        "callee": "packet_input",
        "file": "os/net/ipv6/tcpip.c",
        "line": 439,
        "kind": "direct"
      },
      {
        "caller": "packet_input",
        "callee": "uip_process",
        "file": "os/net/ipv6/tcpip.c",
        "line": 183,
        "kind": "direct"
      },
      {
        "caller": "uip_udp_packet_send",
        "callee": "uip_process",
        "file": "os/net/ipv6/uip-udp-packet.c",
        "line": 58,
        "kind": "direct"
      },
      {
        "caller": "esmrf_in",
        "callee": "uip_process",
        "file": "os/net/ipv6/multicast/esmrf.c",
        "line": 232,
        "kind": "direct"
      }
    ],
    "data_control_flow": [
      {
        "function": "uip_process",
        "file": "os/net/ipv6/uip6.c",
        "kind": "branch",
        "summary": "Switches on IP protocol field; UIP_PROTO_TCP -> goto tcp_input.",
        "line_start": 1415,
        "line_end": 1429
      },
      {
        "function": "uip_process",
        "file": "os/net/ipv6/uip6.c",
        "kind": "def_use",
        "summary": "Reads attacker-controlled UIP_TCP_BUF->tcpoffset (high nibble) into local 'c'. Maximum c = 60 bytes (4-bit nibble * 4).",
        "line_start": 1842,
        "line_end": 1842
      },
      {
        "function": "uip_process",
        "file": "os/net/ipv6/uip6.c",
        "kind": "def_use",
        "summary": "Subtracts c and UIP_IPH_LEN from uip_len without bounds check. uip_len is uint16_t -> arithmetic underflow if uip_len < c + UIP_IPH_LEN.",
        "line_start": 1846,
        "line_end": 1846
      },
      {
        "function": "uip_process",
        "file": "os/net/ipv6/uip6.c",
        "kind": "branch",
        "summary": "Subsequent reads of UIP_TCP_BUF and TCP payload assume uip_len reflects valid in-buffer payload length; after underflow uip_len wraps to a large value.",
        "line_start": 1857,
        "line_end": 1900
      }
    ],
    "guards": [
      {
        "function": "uip_process",
        "file": "os/net/ipv6/uip6.c",
        "guard_call": "uip_len < UIP_IPH_LEN",
        "guard_line": 1120,
        "result_used": true,
        "enforcement_line": 1121,
        "note": "IP-layer minimum length guard. Drops packets too short to even contain an IPv6 header. Does NOT cover the TCP header + options length used at line 1842/1846."
      },
      {
        "function": "uip_process",
        "file": "os/net/ipv6/uip6.c",
        "guard_call": "uip_len < uipbuf_get_len_field(UIP_IP_BUF)",
        "guard_line": 1143,
        "result_used": true,
        "note": "Guards IP payload length against the buffer's declared length. Does not constrain the TCP data-offset-derived 'c'."
      },
      {
        "function": "uip_process",
        "file": "os/net/ipv6/uip6.c",
        "guard_call": "uip_tcpchksum() != 0xffff",
        "guard_line": 1613,
        "result_used": true,
        "enforcement_line": 1619,
        "note": "TCP checksum guard. Drops bad-checksum packets but does NOT validate the TCP data-offset field's relationship to uip_len."
      },
      {
        "function": "uip_process",
        "file": "os/net/ipv6/uip6.c",
        "guard_call": "uip_len < c + UIP_IPH_LEN",
        "guard_line": null,
        "result_used": false,
        "note": "MISSING in vulnerable commit. The fix at fix_commit 63b5e6207 inserts this exact guard between line 1842 and 1846 to prevent underflow."
      }
    ],
    "trust_boundaries": [
      {
        "kind": "network_socket",
        "function": "tcpip_input",
        "file": "os/net/ipv6/tcpip.c",
        "line": 445,
        "direction": "untrusted_to_trusted",
        "note": "Entry point for inbound IPv6 packets handed up from the lower-layer (radio / 6LoWPAN). Attacker-controlled bytes flow from here through packet_input -> uip_input -> uip_process."
      },
      {
        "kind": "network_socket",
        "function": "input_callback",
        "file": "os/net/ipv6/sicslowpan.c",
        "line": 2056,
        "direction": "untrusted_to_trusted",
        "note": "6LoWPAN reassembly callback. Reassembled IPv6 datagram is passed to tcpip_input."
      }
    ],
    "config_mode_command_triggers": [
      {
        "kind": "compile_flag",
        "name": "UIP_TCP",
        "file": "os/net/ipv6/uip6.c",
        "line": 1416,
        "note": "TCP support is conditionally compiled. The vulnerable code at line 1842 is reachable only when UIP_TCP=1. Most TCP-using examples in the tree set this."
      },
      {
        "kind": "ifdef",
        "name": "UIP_CONF_IPV6_CHECKS",
        "file": "os/net/ipv6/uip6.c",
        "line": 1448,
        "note": "Toggles a few additional input checks. The vulnerable arithmetic is unaffected by this flag."
      }
    ],
    "callback_registrations": [
      {
        "registration_site": "PROCESS_THREAD(tcpip_process, ev, data)",
        "callback_function": "packet_input",
        "file": "os/net/ipv6/tcpip.c",
        "line": 439,
        "kind": "function_table",
        "note": "Contiki-NG protothread event dispatch. PACKET_INPUT events posted by tcpip_input cause packet_input() to run."
      }
    ],
    "evidence_anchors": [
      {
        "file": "os/net/ipv6/uip.h",
        "line": 56,
        "kind": "magic_value",
        "note": "UIP_IPH_LEN = 40 (IPv6 header size)"
      },
      {
        "file": "os/net/ipv6/uip.h",
        "line": 60,
        "kind": "magic_value",
        "note": "UIP_TCPH_LEN = 20 (minimum TCP header)"
      },
      {
        "file": "os/net/ipv6/uip.h",
        "line": 81,
        "kind": "structural_artifact",
        "note": "UIP_TCP_BUF macro: pointer alias for the TCP header inside uip_buf. tcpoffset's high nibble is the attacker-controlled data offset in 32-bit words."
      },
      {
        "file": "os/net/ipv6/uip6.c",
        "line": 159,
        "kind": "structural_artifact",
        "note": "Definition of uip_len as uint16_t. Limits the wraparound semantics of the underflow at line 1846."
      }
    ]
  }
}
