{
  "schema_version": "v1",
  "project": "libssh",
  "cve": "CVE-2018-10933",
  "categories": {
    "call_graph": [
      {
        "caller": "ssh_packet_register_socket_callback",
        "callee": "ssh_socket_set_callbacks",
        "file": "src/packet.c",
        "line": 410,
        "kind": "direct",
        "note": "Registration site: installs ssh_packet_socket_callback (assigned at line 406) as the socket data callback. After this, attacker bytes from the wire flow into ssh_packet_socket_callback."
      },
      {
        "caller": "ssh_packet_socket_callback",
        "callee": "ssh_packet_parse_type",
        "file": "src/packet.c",
        "line": 344,
        "kind": "direct",
        "note": "Reads attacker-supplied wire byte into session->in_packet.type."
      },
      {
        "caller": "ssh_packet_socket_callback",
        "callee": "ssh_packet_process",
        "file": "src/packet.c",
        "line": 350,
        "kind": "direct",
        "note": "Dispatches based on attacker-controlled session->in_packet.type without filtering by direction or state."
      },
      {
        "caller": "ssh_packet_process",
        "callee": "ssh_packet_userauth_success",
        "file": "src/packet.c",
        "line": 463,
        "kind": "indirect",
        "note": "Indirect call through default_packet_handlers[type]. For type=52 (SSH2_MSG_USERAUTH_SUCCESS) the table at src/packet.c:90 resolves to ssh_packet_userauth_success."
      }
    ],
    "data_control_flow": [
      {
        "function": "ssh_packet_parse_type",
        "file": "src/packet.c",
        "kind": "def_use",
        "summary": "Reads one wire byte via ssh_buffer_get_u8 into session->in_packet.type. This byte is fully attacker-controlled.",
        "line_start": 531,
        "line_end": 531
      },
      {
        "function": "ssh_packet_process",
        "file": "src/packet.c",
        "kind": "def_use",
        "summary": "Uses the 'type' parameter (passed by ssh_packet_socket_callback at src/packet.c:350 from attacker-controlled session->in_packet.type) to index into cb->callbacks[type - cb->start] and invoke the resolved handler at line 463. No state/direction precondition is consulted.",
        "line_start": 451,
        "line_end": 466
      },
      {
        "function": "ssh_packet_userauth_success",
        "file": "src/auth.c",
        "kind": "def_use",
        "summary": "Unconditionally writes the authenticated state: session->auth.state = SSH_AUTH_STATE_SUCCESS, session->session_state = SSH_SESSION_STATE_AUTHENTICATED, session->flags |= SSH_SESSION_FLAG_AUTHENTICATED.",
        "line_start": 285,
        "line_end": 287
      },
      {
        "function": "ssh_server_connection_callback",
        "file": "src/server.c",
        "kind": "branch",
        "summary": "Branch reading session->flags & SSH_SESSION_FLAG_AUTHENTICATED to fall back into the AUTHENTICATED session_state when the connection callback runs after a re-keying. Demonstrates a downstream consumer of the authenticated flag set by the bypass.",
        "line_start": 524,
        "line_end": 525
      }
    ],
    "guards": [
      {
        "function": "ssh_packet_parse_type",
        "file": "src/packet.c",
        "guard_call": "ssh_buffer_get_u8(session->in_buffer, &session->in_packet.type) == 0",
        "guard_line": 531,
        "result_used": true,
        "enforcement_line": 533,
        "note": "Guards against truncated packets (no type byte). Does NOT validate the value of the type byte."
      },
      {
        "function": "ssh_packet_process",
        "file": "src/packet.c",
        "guard_call": "cb->start > type",
        "guard_line": 457,
        "result_used": true,
        "enforcement_line": 458,
        "note": "Skips callback ranges whose start exceeds the requested type. Range filtering only — does not enforce session state or direction."
      },
      {
        "function": "ssh_packet_process",
        "file": "src/packet.c",
        "guard_call": "cb->start + cb->n_callbacks <= type",
        "guard_line": 459,
        "result_used": true,
        "enforcement_line": 460,
        "note": "Skips callback ranges whose end is below the requested type. Same character as the previous guard."
      },
      {
        "function": "ssh_packet_process",
        "file": "src/packet.c",
        "guard_call": "cb->callbacks[type - cb->start] == NULL",
        "guard_line": 461,
        "result_used": true,
        "enforcement_line": 462,
        "note": "Skips NULL slots. Does not check whether the callback is appropriate for the current session role/state."
      }
    ],
    "trust_boundaries": [
      {
        "kind": "network_socket",
        "function": "ssh_packet_socket_callback",
        "file": "src/packet.c",
        "line": 144,
        "direction": "untrusted_to_trusted",
        "note": "Entry point for inbound SSH transport-layer packets. Receives the raw bytes the peer placed on the socket. After ssh_packet_register_socket_callback (line 405) installs it, every byte the SSH peer sends arrives here."
      }
    ],
    "config_mode_command_triggers": [
      {
        "kind": "ifdef",
        "name": "WITH_SERVER",
        "file": "src/packet.c",
        "line": 84,
        "note": "#if WITH_SERVER directive at line 84 gates the inclusion of ssh_packet_userauth_request (server-only) at line 85. By contrast SSH2_MSG_USERAUTH_SUCCESS handler at index 52 (line 90) is unconditional — registered for server builds too even though the message is direction-wise client-only. This is the structural opening the CVE exploits."
      },
      {
        "kind": "compile_flag",
        "name": "WITH_SERVER",
        "file": "src/server.c",
        "line": 524,
        "note": "Server-side KEX completion is gated on WITH_SERVER. The session->flags consumer at line 524 is the downstream reader of the bypass-set flag."
      }
    ],
    "callback_registrations": [
      {
        "registration_site": "ssh_packet_register_socket_callback (src/packet.c:405)",
        "callback_function": "ssh_packet_socket_callback",
        "file": "src/packet.c",
        "line": 406,
        "kind": "function_pointer_assignment",
        "note": "Assigns ssh_packet_socket_callback to session->socket_callbacks.data, then propagates that struct via ssh_socket_set_callbacks (line 410). This is the formal trust-boundary registration."
      },
      {
        "registration_site": "default_packet_handlers[] static table",
        "callback_function": "ssh_packet_userauth_success",
        "file": "src/packet.c",
        "line": 90,
        "kind": "function_table",
        "note": "Static dispatch table indexed by SSH packet type. Index 52 = SSH2_MSG_USERAUTH_SUCCESS -> ssh_packet_userauth_success. Used at src/packet.c:463 (ssh_packet_process). The lookup carries no direction or state precondition."
      }
    ],
    "evidence_anchors": [
      {
        "file": "include/libssh/session.h",
        "line": 41,
        "kind": "structural_artifact",
        "note": "enum ssh_session_state_e member SSH_SESSION_STATE_AUTHENTICATED — the symbolic value the bypass sets at src/auth.c:286."
      },
      {
        "file": "include/libssh/session.h",
        "line": 70,
        "kind": "magic_value",
        "note": "#define SSH_SESSION_FLAG_AUTHENTICATED 2 — the bit OR'd into session->flags at src/auth.c:287."
      },
      {
        "file": "include/libssh/session.h",
        "line": 137,
        "kind": "structural_artifact",
        "note": "session_state field of struct ssh_session_struct — written at the bypass and read at src/server.c:524, src/wrapper.c:506, src/wrapper.c:521, src/client.c:441, src/kex.c:443."
      }
    ]
  }
}
