{
  "schema_version": "v1",
  "project": "mbedtls",
  "cve": "CVE-2018-0488",
  "categories": {
    "call_graph": [
      {
        "caller": "mbedtls_ssl_read",
        "callee": "mbedtls_ssl_read_record",
        "file": "library/ssl_tls.c",
        "line": 6861,
        "kind": "direct",
        "note": "mbedtls_ssl_read() calls mbedtls_ssl_read_record() at line 6861 to retrieve and decrypt the next TLS record from the network."
      },
      {
        "caller": "mbedtls_ssl_read_record",
        "callee": "mbedtls_ssl_read_record_layer",
        "file": "library/ssl_tls.c",
        "line": 3734,
        "kind": "direct",
        "note": "mbedtls_ssl_read_record calls mbedtls_ssl_read_record_layer for per-layer record fetch and decryption."
      },
      {
        "caller": "mbedtls_ssl_read_record_layer",
        "callee": "ssl_prepare_record_content",
        "file": "library/ssl_tls.c",
        "line": 3936,
        "kind": "direct",
        "note": "mbedtls_ssl_read_record_layer calls ssl_prepare_record_content at line 3936 to decrypt and authenticate the fetched record content."
      },
      {
        "caller": "ssl_prepare_record_content",
        "callee": "ssl_decrypt_buf",
        "file": "library/ssl_tls.c",
        "line": 3677,
        "kind": "direct",
        "note": "ssl_prepare_record_content calls ssl_decrypt_buf() at line 3677 when !done && ssl->transform_in != NULL (guard at line 3675). ssl_decrypt_buf performs CBC decryption and MAC verification."
      },
      {
        "caller": "ssl_decrypt_buf",
        "callee": "mbedtls_md_hmac_finish",
        "file": "library/ssl_tls.c",
        "line": 1968,
        "kind": "direct",
        "note": "ssl_decrypt_buf calls mbedtls_md_hmac_finish to compute the expected MAC directly into ssl->in_msg + ssl->in_msglen. When truncated HMAC is in use (maclen=10), mbedtls_md_hmac_finish writes the full MAC digest (20 bytes for SHA-1, 32 for SHA-256) past the 10-byte MAC slot in the heap."
      }
    ],
    "data_control_flow": [
      {
        "function": "ssl_decrypt_buf",
        "file": "library/ssl_tls.c",
        "kind": "def_use",
        "summary": "At line 1968, mbedtls_md_hmac_finish writes the computed HMAC digest to ssl->in_msg + ssl->in_msglen. ssl->in_msglen is the length of the decrypted plaintext; after it, the record buffer has exactly ssl->transform_in->maclen bytes allocated for the MAC. When truncated HMAC is enabled, maclen = MBEDTLS_SSL_TRUNCATED_HMAC_LEN = 10 (ssl_tls.c:713). mbedtls_md_hmac_finish writes the FULL digest length (not truncated), overflowing by (full_digest_size - 10) bytes past the MAC slot.",
        "line_start": 1960,
        "line_end": 1989
      },
      {
        "function": "mbedtls_ssl_setup_transform",
        "file": "library/ssl_tls.c",
        "kind": "def_use",
        "summary": "At line 704, transform->maclen = mbedtls_md_get_size(md_info) (full MAC size). At line 712-713, if truncated HMAC is negotiated, transform->maclen is overridden to MBEDTLS_SSL_TRUNCATED_HMAC_LEN = 10. This maclen is used as the MAC allocation size in the record buffer but NOT as the write length for mbedtls_md_hmac_finish — the finish function always writes the full digest.",
        "line_start": 700,
        "line_end": 714
      }
    ],
    "guards": [
      {
        "function": "ssl_prepare_record_content",
        "file": "library/ssl_tls.c",
        "guard_call": "!done && ssl->transform_in != NULL",
        "guard_line": 3675,
        "result_used": true,
        "note": "ssl_decrypt_buf is called only after the TLS handshake has completed and a cipher transform is installed (transform_in != NULL). The attacker must first complete the handshake negotiating CBC + truncated HMAC before sending application data records."
      }
    ],
    "trust_boundaries": [
      {
        "kind": "network_socket",
        "function": "mbedtls_ssl_read",
        "file": "library/ssl_tls.c",
        "line": 6759,
        "direction": "untrusted_to_trusted",
        "note": "mbedtls_ssl_read is the application-level API for reading TLS/DTLS records from the network. The network data flows through the record layer and is processed by ssl_decrypt_buf. An attacker controlling the remote TLS peer can send any application data record to trigger ssl_decrypt_buf's MAC verification with truncated HMAC."
      }
    ],
    "config_mode_command_triggers": [],
    "callback_registrations": [],
    "evidence_anchors": []
  }
}
