{
  "schema_version": "v1",
  "project": "nginx",
  "cve": "CVE-2025-23419",
  "categories": {
    "call_graph": [
      {"caller": "ngx_http_init_connection",  "callee": "ngx_http_ssl_handshake",         "file": "src/http/ngx_http_request.c", "line": 332,  "kind": "indirect"},
      {"caller": "ngx_http_ssl_handshake",    "callee": "ngx_ssl_handshake",              "file": "src/http/ngx_http_request.c", "line": 779,  "kind": "direct"},
      {"caller": "ngx_ssl_handshake",         "callee": "SSL_do_handshake",               "file": "src/event/ngx_event_openssl.c", "line": 1721, "kind": "direct"},
      {"caller": "ngx_http_ssl_servername",   "callee": "SSL_get_servername",             "file": "src/http/ngx_http_request.c", "line": 895,  "kind": "direct"},
      {"caller": "ngx_http_ssl_servername",   "callee": "ngx_http_validate_host",         "file": "src/http/ngx_http_request.c", "line": 914,  "kind": "direct"},
      {"caller": "ngx_http_ssl_servername",   "callee": "ngx_http_find_virtual_server",   "file": "src/http/ngx_http_request.c", "line": 924,  "kind": "direct"},
      {"caller": "ngx_http_ssl_servername",   "callee": "SSL_set_SSL_CTX",                "file": "src/http/ngx_http_request.c", "line": 953,  "kind": "direct"},
      {"caller": "ngx_http_ssl_servername",   "callee": "SSL_set_verify",                 "file": "src/http/ngx_http_request.c", "line": 962,  "kind": "direct"},
      {"caller": "ngx_stream_ssl_servername", "callee": "ngx_stream_find_virtual_server", "file": "src/stream/ngx_stream_ssl_module.c", "line": 582,  "kind": "direct"},
      {"caller": "ngx_stream_ssl_servername", "callee": "SSL_set_SSL_CTX",                "file": "src/stream/ngx_stream_ssl_module.c", "line": 599,  "kind": "direct"}
    ],
    "data_control_flow": [
      {"function": "ngx_http_ssl_servername",   "file": "src/http/ngx_http_request.c", "kind": "branch",  "summary": "TLS SNI callback. Steps: (1) get servername via SSL_get_servername (line 895); (2) validate host syntax via ngx_http_validate_host (line 914); (3) find the virtual server config via ngx_http_find_virtual_server (line 924) — this is where the per-connection target vhost is selected by SNI. After the lookup at lines 931-933 (rc == NGX_DECLINED check), the function commits hc->ssl_servername (line 935), hc->conf_ctx (line 942), and SSL_CTX swap via SSL_set_SSL_CTX (line 953). In TLS 1.3 + OpenSSL session resumption, the session has already been resumed in the default SSL_CTX before this callback runs; the verify-mode update at line 962-963 (SSL_set_verify) does not retroactively apply to the resumed session.", "line_start": 875, "line_end": 1014},
      {"function": "ngx_http_ssl_servername",   "file": "src/http/ngx_http_request.c", "kind": "def_use", "summary": "Path between the virtual-server lookup (lines 924-925) and the config commit (lines 935-942) lacks any check that the resumed session's hostname (SSL_SESSION_get0_hostname) matches the new servername. The fix inserts that check between line 933 and line 935; the vulnerable code commits to the new vhost without re-validating the resumed session.", "line_start": 924, "line_end": 942},
      {"function": "ngx_stream_ssl_servername", "file": "src/stream/ngx_stream_ssl_module.c", "kind": "branch",  "summary": "Symmetric TLS SNI callback for the stream module. Same shape as the HTTP callback: SSL_get_servername (line 553) → ngx_stream_validate_host (line 572) → ngx_stream_find_virtual_server (line 582) → SSL_set_SSL_CTX (line 599) without cross-SNI verify check. The fix adds the same SSL_SESSION_get0_hostname check between line 590 and line 592 in this file.", "line_start": 534, "line_end": 645}
    ],
    "guards": [
      {"function": "ngx_http_ssl_servername",   "file": "src/http/ngx_http_request.c", "guard_call": "if (c->ssl->handshaked)",                "guard_line": 888,  "result_used": true,  "enforcement_line": 890,  "note": "Renegotiation guard — rejects re-entry of the SNI callback on already-handshaked connections via return SSL_TLSEXT_ERR_ALERT_FATAL at line 890. Not a session-resumption guard."},
      {"function": "ngx_http_ssl_servername",   "file": "src/http/ngx_http_request.c", "guard_call": "if (servername == NULL)",                 "guard_line": 897,  "result_used": true,  "enforcement_line": 900,  "note": "If no SNI was sent, the callback bails out via 'goto done' and the connection proceeds with the default SSL_CTX. Not the cross-SNI guard."},
      {"function": "ngx_http_ssl_servername",   "file": "src/http/ngx_http_request.c", "guard_call": "ngx_http_validate_host(&host, c->pool, 1)", "guard_line": 914,  "result_used": true,  "enforcement_line": 917,  "note": "Host syntax guard — rejects malformed SNI strings."},
      {"function": "ngx_http_ssl_servername",   "file": "src/http/ngx_http_request.c", "guard_call": "ngx_http_find_virtual_server(...)",        "guard_line": 924,  "result_used": true,  "enforcement_line": 932,  "note": "Virtual server lookup. On NGX_DECLINED (no match) the callback bails out; on NGX_OK it falls through to commit the new vhost config. There is no follow-up guard between line 933 (close of NGX_DECLINED branch) and line 935 (first commit) that checks whether the connection's session was resumed under a different SNI — the fix introduces precisely this guard."}
    ],
    "trust_boundaries": [
      {"kind": "network_socket", "function": "ngx_http_init_connection",  "file": "src/http/ngx_http_request.c",         "line": 200, "direction": "untrusted_to_trusted", "note": "Per-connection HTTP-init handler. The remote peer's SNI in ClientHello and the session ticket are attacker-controlled inputs that flow into the SSL handshake state machine and ultimately into ngx_http_ssl_servername."},
      {"kind": "network_socket", "function": "ngx_stream_ssl_servername", "file": "src/stream/ngx_stream_ssl_module.c", "line": 534, "direction": "untrusted_to_trusted", "note": "Per-connection SNI callback for the stream module — same boundary semantics as HTTP."}
    ],
    "config_mode_command_triggers": [
      {"kind": "ifdef", "name": "SSL_CTRL_SET_TLSEXT_HOSTNAME", "file": "src/http/ngx_http_request.c",                "line": 872, "note": "#ifdef SSL_CTRL_SET_TLSEXT_HOSTNAME — gates the entire ngx_http_ssl_servername function. Defined when OpenSSL was built with SNI support (always true for any recent OpenSSL build)."},
      {"kind": "ifdef", "name": "SSL_CTRL_SET_TLSEXT_HOSTNAME", "file": "src/http/modules/ngx_http_ssl_module.c",     "line": 740, "note": "#ifdef SSL_CTRL_SET_TLSEXT_HOSTNAME — gates the SSL_CTX_set_tlsext_servername_callback call that registers ngx_http_ssl_servername as the SNI callback."},
      {"kind": "ifdef", "name": "SSL_CTRL_SET_TLSEXT_HOSTNAME", "file": "src/stream/ngx_stream_ssl_module.c",         "line": 531, "note": "#ifdef SSL_CTRL_SET_TLSEXT_HOSTNAME — gates the entire ngx_stream_ssl_servername function in the stream module."},
      {"kind": "ifdef", "name": "NGX_HTTP_SSL",                 "file": "src/http/ngx_http_request.c",                "line": 328, "note": "#if (NGX_HTTP_SSL) — gates the SSL handshake handler installation in ngx_http_init_connection."}
    ],
    "callback_registrations": [
      {"registration_site": "SSL_CTX_set_tlsext_servername_callback(conf->ssl.ctx, ngx_http_ssl_servername)",   "callback_function": "ngx_http_ssl_servername",   "file": "src/http/modules/ngx_http_ssl_module.c", "line": 742, "kind": "callback_argument", "note": "OpenSSL SNI callback registration via SSL_CTX_set_tlsext_servername_callback. The function name ngx_http_ssl_servername is passed as the callback argument; OpenSSL will invoke it when ClientHello arrives. This is the install site that connects OpenSSL's SNI dispatch to nginx's vhost-routing logic."},
      {"registration_site": "SSL_CTX_set_tlsext_servername_callback(conf->ssl.ctx, ngx_stream_ssl_servername)", "callback_function": "ngx_stream_ssl_servername", "file": "src/stream/ngx_stream_ssl_module.c",     "line": 971, "kind": "callback_argument", "note": "Symmetric SNI callback registration for the stream module."},
      {"registration_site": "rev->handler = ngx_http_ssl_handshake",                                            "callback_function": "ngx_http_ssl_handshake",    "file": "src/http/ngx_http_request.c",            "line": 332, "kind": "function_pointer_assignment", "note": "ngx_http_init_connection installs ngx_http_ssl_handshake as the connection's read-event handler when SSL is enabled on the listen socket. This is the chain that gets the connection from accept() to the OpenSSL handshake state machine."}
    ],
    "evidence_anchors": [
      {"file": "src/http/ngx_http_request.c", "line": 875, "kind": "structural_artifact", "note": "ngx_http_ssl_servername — top-level definition of the SNI callback. Vulnerable function for the HTTP path."},
      {"file": "src/stream/ngx_stream_ssl_module.c", "line": 534, "kind": "structural_artifact", "note": "ngx_stream_ssl_servername — top-level definition of the symmetric stream-module SNI callback."}
    ]
  }
}
